{
  "document_type": "era-geometry-lineage",
  "era": "1936",
  "milestone": "M15",
  "notes": [
    "Composed era-geometry packs (M20): we-1936-v1, ce-1936-v1",
    "scaffold_province_id remains the stable join key across steps."
  ],
  "pack_id": "we-1936-v1+ce-1936-v1",
  "row_count": 11,
  "rows": [
    {
      "display_name": "Vienna basin",
      "era_province_id": "sample_at_vienna",
      "geometry_mode": "hard_overrides",
      "in_priority_region": true,
      "operation": "identity",
      "reason": "Vienna retained; Anschluss story via soft corridor + politics.",
      "scaffold_province_id": "sample_at_vienna"
    },
    {
      "display_name": "Flanders",
      "era_province_id": "sample_be_flanders",
      "geometry_mode": "hard_overrides",
      "in_priority_region": true,
      "operation": "identity",
      "reason": "Flanders retained as scaffold identity.",
      "scaffold_province_id": "sample_be_flanders"
    },
    {
      "display_name": "Bohemia (1936)",
      "era_province_id": "era_cz_bohemia_1936",
      "geometry_mode": "hard_overrides",
      "in_priority_region": true,
      "operation": "replace",
      "reason": "Interwar Czechoslovakia core label + modest footprint for Sudeten-band readability on the CE sample.",
      "scaffold_province_id": "sample_cz_bohemia"
    },
    {
      "display_name": "Bohemia",
      "era_province_id": "sample_cz_bohemia",
      "geometry_mode": "scaffold",
      "in_priority_region": false,
      "operation": "identity",
      "scaffold_province_id": "sample_cz_bohemia"
    },
    {
      "display_name": "Rhineland (1936)",
      "era_province_id": "era_de_rhineland_1936",
      "geometry_mode": "hard_overrides",
      "in_priority_region": true,
      "operation": "replace",
      "reason": "Interwar Rhineland label + modest footprint for demilitarized zone readability on the WE sample.",
      "scaffold_province_id": "sample_de_rhineland"
    },
    {
      "display_name": "Normandy coast",
      "era_province_id": "sample_fr_normandy",
      "geometry_mode": "hard_overrides",
      "in_priority_region": true,
      "operation": "identity",
      "reason": "Normandy retained; Channel story via soft hints.",
      "scaffold_province_id": "sample_fr_normandy"
    },
    {
      "display_name": "Paris basin",
      "era_province_id": "sample_fr_paris",
      "geometry_mode": "hard_overrides",
      "in_priority_region": true,
      "operation": "identity",
      "reason": "Third Republic core retained.",
      "scaffold_province_id": "sample_fr_paris"
    },
    {
      "display_name": "Pannonia plain",
      "era_province_id": "sample_hu_pannon",
      "geometry_mode": "hard_overrides",
      "in_priority_region": true,
      "operation": "identity",
      "reason": "Hungarian plain retained; revisionist fringe via soft frontier.",
      "scaffold_province_id": "sample_hu_pannon"
    },
    {
      "display_name": "Luxembourg core",
      "era_province_id": "sample_lu_core",
      "geometry_mode": "hard_overrides",
      "in_priority_region": true,
      "operation": "identity",
      "reason": "Luxembourg retained.",
      "scaffold_province_id": "sample_lu_core"
    },
    {
      "display_name": "Holland",
      "era_province_id": "sample_nl_holland",
      "geometry_mode": "hard_overrides",
      "in_priority_region": true,
      "operation": "identity",
      "reason": "Holland retained.",
      "scaffold_province_id": "sample_nl_holland"
    },
    {
      "display_name": "Mazovia",
      "era_province_id": "sample_pl_mazovia",
      "geometry_mode": "hard_overrides",
      "in_priority_region": true,
      "operation": "identity",
      "reason": "Mazovia retained; corridor story via soft northern band.",
      "scaffold_province_id": "sample_pl_mazovia"
    }
  ],
  "scenario_id": "official-1936",
  "schema_version": "0.1.0"
}
