{
  "document_type": "era-geometry-lineage",
  "era": "1444",
  "milestone": "M15",
  "notes": [
    "Composed era-geometry packs (M20): we-1444-v1, ce-1444-v1",
    "scaffold_province_id remains the stable join key across steps."
  ],
  "pack_id": "we-1444-v1+ce-1444-v1",
  "row_count": 14,
  "rows": [
    {
      "display_name": "Vienna basin",
      "era_province_id": "sample_at_vienna",
      "geometry_mode": "hard_overrides",
      "in_priority_region": true,
      "operation": "identity",
      "reason": "Vienna basin retained as scaffold shape; Habsburg story via politics + corridor hint.",
      "scaffold_province_id": "sample_at_vienna"
    },
    {
      "display_name": "Flanders (period)",
      "era_province_id": "era_be_flanders",
      "geometry_mode": "hard_overrides",
      "in_priority_region": true,
      "operation": "replace",
      "reason": "Slight reshape toward a denser Low Countries footprint for Burgundian readability.",
      "scaffold_province_id": "sample_be_flanders"
    },
    {
      "display_name": "Bohemia residual",
      "era_province_id": "era_cz_bohemia_residual",
      "geometry_mode": "hard_overrides",
      "in_priority_region": true,
      "operation": "split_child",
      "part_count": 2,
      "part_index": 2,
      "reason": "Separate Prague core from residual Bohemia so 1444 politics are not painted as modern CZE-wide admin.",
      "scaffold_province_id": "sample_cz_bohemia"
    },
    {
      "display_name": "Prague",
      "era_province_id": "era_cz_prague",
      "geometry_mode": "hard_overrides",
      "in_priority_region": true,
      "operation": "split_child",
      "part_count": 2,
      "part_index": 1,
      "reason": "Separate Prague core from residual Bohemia so 1444 politics are not painted as modern CZE-wide admin.",
      "scaffold_province_id": "sample_cz_bohemia"
    },
    {
      "display_name": "Bohemia",
      "era_province_id": "sample_cz_bohemia",
      "geometry_mode": "scaffold",
      "in_priority_region": false,
      "operation": "identity",
      "scaffold_province_id": "sample_cz_bohemia"
    },
    {
      "display_name": "Cologne",
      "era_province_id": "era_de_cologne",
      "geometry_mode": "hard_overrides",
      "in_priority_region": true,
      "operation": "split_child",
      "part_count": 2,
      "part_index": 1,
      "reason": "Separate ecclesiastical Cologne from residual Rhineland so 1444 politics are not painted as modern DE-NW.",
      "scaffold_province_id": "sample_de_rhineland"
    },
    {
      "display_name": "Rhineland residual",
      "era_province_id": "era_de_rhineland_residual",
      "geometry_mode": "hard_overrides",
      "in_priority_region": true,
      "operation": "split_child",
      "part_count": 2,
      "part_index": 2,
      "reason": "Separate ecclesiastical Cologne from residual Rhineland so 1444 politics are not painted as modern DE-NW.",
      "scaffold_province_id": "sample_de_rhineland"
    },
    {
      "display_name": "Normandy coast",
      "era_province_id": "sample_fr_normandy",
      "geometry_mode": "hard_overrides",
      "in_priority_region": true,
      "operation": "identity",
      "reason": "Normandy retained as scaffold shape in v1; soft Channel hint covers Calais story.",
      "scaffold_province_id": "sample_fr_normandy"
    },
    {
      "display_name": "Paris basin",
      "era_province_id": "sample_fr_paris",
      "geometry_mode": "hard_overrides",
      "in_priority_region": true,
      "operation": "identity",
      "reason": "French crown core retained; lineage documents priority-region identity mapping.",
      "scaffold_province_id": "sample_fr_paris"
    },
    {
      "display_name": "Pannonia (period)",
      "era_province_id": "era_hu_pannon",
      "geometry_mode": "hard_overrides",
      "in_priority_region": true,
      "operation": "replace",
      "reason": "Slight reshape toward a denser Hungarian plain footprint for 1444 readability.",
      "scaffold_province_id": "sample_hu_pannon"
    },
    {
      "display_name": "Pannonia plain",
      "era_province_id": "sample_hu_pannon",
      "geometry_mode": "scaffold",
      "in_priority_region": false,
      "operation": "identity",
      "scaffold_province_id": "sample_hu_pannon"
    },
    {
      "display_name": "Luxembourg (Burgundian)",
      "era_province_id": "era_lu_luxembourg",
      "geometry_mode": "hard_overrides",
      "in_priority_region": true,
      "operation": "replace",
      "reason": "Period-facing label and modest footprint nudge for Burgundian Luxembourg.",
      "scaffold_province_id": "sample_lu_core"
    },
    {
      "display_name": "Holland",
      "era_province_id": "sample_nl_holland",
      "geometry_mode": "hard_overrides",
      "in_priority_region": true,
      "operation": "identity",
      "reason": "Holland retained; Burgundian story told via politics + Low Countries band.",
      "scaffold_province_id": "sample_nl_holland"
    },
    {
      "display_name": "Mazovia",
      "era_province_id": "sample_pl_mazovia",
      "geometry_mode": "hard_overrides",
      "in_priority_region": true,
      "operation": "identity",
      "reason": "Mazovia retained; Jagiellon story via politics + western approach band.",
      "scaffold_province_id": "sample_pl_mazovia"
    }
  ],
  "scenario_id": "official-1444",
  "schema_version": "0.1.0"
}
