{
  "document_type": "era-geometry-lineage",
  "era": "1836",
  "milestone": "M15",
  "notes": [
    "Composed era-geometry packs (M20): we-1836-v1, ce-1836-v1",
    "scaffold_province_id remains the stable join key across steps."
  ],
  "pack_id": "we-1836-v1+ce-1836-v1",
  "row_count": 11,
  "rows": [
    {
      "display_name": "Vienna (1836)",
      "era_province_id": "era_at_vienna_1836",
      "geometry_mode": "hard_overrides",
      "in_priority_region": true,
      "operation": "replace",
      "reason": "Austrian Empire capital readability; modest footprint nudge on the CE sample.",
      "scaffold_province_id": "sample_at_vienna"
    },
    {
      "display_name": "Vienna basin",
      "era_province_id": "sample_at_vienna",
      "geometry_mode": "scaffold",
      "in_priority_region": false,
      "operation": "identity",
      "scaffold_province_id": "sample_at_vienna"
    },
    {
      "display_name": "Flanders (1836)",
      "era_province_id": "era_be_flanders_1836",
      "geometry_mode": "hard_overrides",
      "in_priority_region": true,
      "operation": "replace",
      "reason": "Independent Belgium readability; modest footprint nudge on the WE sample.",
      "scaffold_province_id": "sample_be_flanders"
    },
    {
      "display_name": "Bohemia",
      "era_province_id": "sample_cz_bohemia",
      "geometry_mode": "hard_overrides",
      "in_priority_region": true,
      "operation": "identity",
      "reason": "Bohemia retained as scaffold shape; crownland story via soft band + politics.",
      "scaffold_province_id": "sample_cz_bohemia"
    },
    {
      "display_name": "Rhineland",
      "era_province_id": "sample_de_rhineland",
      "geometry_mode": "hard_overrides",
      "in_priority_region": true,
      "operation": "identity",
      "reason": "Prussian Rhineland retained as scaffold shape; soft Rhine hint covers 1836 story.",
      "scaffold_province_id": "sample_de_rhineland"
    },
    {
      "display_name": "Normandy coast",
      "era_province_id": "sample_fr_normandy",
      "geometry_mode": "hard_overrides",
      "in_priority_region": true,
      "operation": "identity",
      "reason": "Normandy retained as scaffold identity in v1.",
      "scaffold_province_id": "sample_fr_normandy"
    },
    {
      "display_name": "Paris basin",
      "era_province_id": "sample_fr_paris",
      "geometry_mode": "hard_overrides",
      "in_priority_region": true,
      "operation": "identity",
      "reason": "July Monarchy core retained.",
      "scaffold_province_id": "sample_fr_paris"
    },
    {
      "display_name": "Pannonia plain",
      "era_province_id": "sample_hu_pannon",
      "geometry_mode": "hard_overrides",
      "in_priority_region": true,
      "operation": "identity",
      "reason": "Hungarian plain retained; lands-under-Habsburg story via soft frontier.",
      "scaffold_province_id": "sample_hu_pannon"
    },
    {
      "display_name": "Luxembourg core",
      "era_province_id": "sample_lu_core",
      "geometry_mode": "hard_overrides",
      "in_priority_region": true,
      "operation": "identity",
      "reason": "Luxembourg retained; personal-union / Confederation story via politics.",
      "scaffold_province_id": "sample_lu_core"
    },
    {
      "display_name": "Holland",
      "era_province_id": "sample_nl_holland",
      "geometry_mode": "hard_overrides",
      "in_priority_region": true,
      "operation": "identity",
      "reason": "Holland retained; Dutch\u2013Belgian story told via politics + frontier band.",
      "scaffold_province_id": "sample_nl_holland"
    },
    {
      "display_name": "Mazovia",
      "era_province_id": "sample_pl_mazovia",
      "geometry_mode": "hard_overrides",
      "in_priority_region": true,
      "operation": "identity",
      "reason": "Mazovia retained; Congress Poland / partition story via politics + Galicia band.",
      "scaffold_province_id": "sample_pl_mazovia"
    }
  ],
  "scenario_id": "official-1836",
  "schema_version": "0.1.0"
}
