{
  "document_type": "era-geometry-lineage",
  "era": "1836",
  "milestone": "M15",
  "notes": [
    "Curator-authored soft frontier bands and sample hard overrides for M16 multi-era packs.",
    "Not derived from proprietary game maps.",
    "Hard overrides target beta sample province_ids (sample_*); they skip cleanly on full Natural Earth builds.",
    "Soft boundary hints are geographic and apply on any scaffold that intersects the priority region."
  ],
  "pack_id": "we-1836-v1",
  "row_count": 6,
  "rows": [
    {
      "display_name": "Flanders (1836)",
      "era_province_id": "era_be_flanders_1836",
      "geometry_mode": "hard_overrides",
      "in_priority_region": true,
      "operation": "replace",
      "reason": "Independent Belgium readability; modest footprint nudge on the WE sample.",
      "scaffold_province_id": "sample_be_flanders"
    },
    {
      "display_name": "Rhineland",
      "era_province_id": "sample_de_rhineland",
      "geometry_mode": "hard_overrides",
      "in_priority_region": true,
      "operation": "identity",
      "reason": "Prussian Rhineland retained as scaffold shape; soft Rhine hint covers 1836 story.",
      "scaffold_province_id": "sample_de_rhineland"
    },
    {
      "display_name": "Normandy coast",
      "era_province_id": "sample_fr_normandy",
      "geometry_mode": "hard_overrides",
      "in_priority_region": true,
      "operation": "identity",
      "reason": "Normandy retained as scaffold identity in v1.",
      "scaffold_province_id": "sample_fr_normandy"
    },
    {
      "display_name": "Paris basin",
      "era_province_id": "sample_fr_paris",
      "geometry_mode": "hard_overrides",
      "in_priority_region": true,
      "operation": "identity",
      "reason": "July Monarchy core retained.",
      "scaffold_province_id": "sample_fr_paris"
    },
    {
      "display_name": "Luxembourg core",
      "era_province_id": "sample_lu_core",
      "geometry_mode": "hard_overrides",
      "in_priority_region": true,
      "operation": "identity",
      "reason": "Luxembourg retained; personal-union / Confederation story via politics.",
      "scaffold_province_id": "sample_lu_core"
    },
    {
      "display_name": "Holland",
      "era_province_id": "sample_nl_holland",
      "geometry_mode": "hard_overrides",
      "in_priority_region": true,
      "operation": "identity",
      "reason": "Holland retained; Dutch\u2013Belgian story told via politics + frontier band.",
      "scaffold_province_id": "sample_nl_holland"
    }
  ],
  "scenario_id": "official-1836",
  "schema_version": "0.1.0"
}
